{
  "schema": "ADworkflo.semantic_slice.v1",
  "status": "not_prepared",
  "graph_revision": null,
  "entrypoints": [],
  "entrypoint_resolutions": [],
  "included_symbols": [],
  "included_files": [],
  "boundary_symbols": [],
  "excluded": [],
  "unresolved_edges": [],
  "likely_tests": [],
  "coverage": {},
  "confidence": 0,
  "truncated": false,
  "source_hashes": {},
  "provenance": [],
  "parameters": {"depth": 2, "budget": 100, "include_callers": false},
  "expansion_history": [],
  "predicted_impact_files": []
}
